<!DOCTYPE acl SYSTEM "aclpokus.dtd">
<acl aclname="my_first_acl">
    <Principals>
        <Groups>
            <group id="all">
                <membership/>
            </group> 
            <group id="Developers">
                <membership>    <!--Developers are members of Administrators-->
                    <group idref="Administrators"/>
                </membership>
            </group>
            <group id="Administrators">
                <membership/>
            </group>
            <group id="Users">
                <membership/>
            </group>
        </Groups>
        <Individuals>
        </Individuals>

    </Principals>
    
    <Privileges>
        
    </Privileges>
    
    <ResourceObjects>    

    </ResourceObjects>
    
    <ACEs>

            
    </ACEs>
</acl>